,titulo,artista,letras
491,Sarà perché ti amo,Ricchi e Poveri," Che confusione, sarà perché ti amo. È un'emozione che cresce piano piano. Stringimi forte, e stammi più vicino. Se ci sto bene, sarà perché ti amo.. Io canto al ritmo del dolce tuo respiro. È primavera, sarà perché ti amo. Cade una stella, ma dimmi dove siamo. Che te ne frega, sarà perché ti amo.. E vola vola si sa, sempre più in alto si va. E vola vola con me, il mondo è matto perché. E se l'amore non c'è. Basta una sola canzone,per farconfusione. Fuori e dentro di te.. E vola vola si va, sempre più in alto si va. E vola vola con me,il mondo è matto perché. E se l'amore non c'è. Basta una sola canzone, per far confusione. Fuori e dentro di te.. Ma dopo tutto, che cosa c'è di strano. È una canzone, sarà perché ti amo. Se cade il mondo, allora ci spostiamo. Se cade il mondo, sarà perché ti amo.. Stringimi forte, e stammi più vicino. È così bello, che non mi sembra vero. Se il mondo è matto che cosa c'è di strano. E vola vola si va, sempre più in alto si va. E vola vola con me,il mondo è matto perché. E se l'amore non c'è. Basta una sola canzone, per far confusione. Fuori e dentro di te.. E vola vola si va, sarà perché ti amo. Io canto al ritmo del dolce tuo respiro. È primavera sarà perché ti amo. Cade una stella ma dimmi dove siamo. Che te ne frega, sarà perché ti amo.. Na na na na, na na na na na na na. Na na na na, sempre più il alto si va.. È primavera, sarà perché ti amo. Cade una stella, sarà perché ti amo. Ed è per questo, che canto piano piano. Una canzone, sarà perché ti amo.. E canto al ritmo del dolce tuo respiro. È così bello, che non mi sembra vero. Se il mondo è matto che cosa c'è di strano. Matto per matto, almeno noi ci amiamo..  "
492,Cai neve em nova York,José Cid," A neve cai tapando as ruas.     Num manto corroído cor marfim.     Eu sigo só na multidão.     P'ra descobrir o homem que há em mim..     Deixei para trás a vida cheia de loucura.     Fechei a porta onde não mais quero entrar..     Ando ao acaso pelas ruas da cidade.     Assobiando, mãos nos bolsos a sonhar..  .            * Refrão *.     Cai neve em Nova Iorque.     Há sol no meu país.     Fazme falta Lisboa.     P'ra me sentir feliz.     Não há mais pôrdosol.     Em Sunset Boulevard.     Cai neve em Nova Iorque.     Ninguém vaime encontrar..              *       *.     E foi assim que na 42nd Street.     Alguém me chama e oferece um cigarrinho..     Muito obrigado amigo não.     Não vou fumar.     Em Lisboa deixei esse caminho..     Deixei para trás a vida cheia de loucura.     Fechei a porta onde não mais quero entrar..     Ando ao acaso pelas ruas da cidade.     Assobiando, mãos nos bolsos a sonhar..     Refrão (2x).  "
493,Ele Nunca Vai Saber,Chicabana," Foi no final daquela festa que eu te vi. Sentada no cantinho, sozinha ali,  fiz de tudo pra chamar sua atenção. Ele te deixou sozinha por alguns minutos. Tentei me aproximar meio que de intruso. Típico do cara que por amor, perde a noção. Foi então, que o seu olhar, se cruzou pela primeira vez com o meu. Foi paixao me faltou o ar. E a solução eu acabo de encontrar. Vamos namorar escondido. Pra que tanto tempo perdido. Eu juro que ele nunca vai saber, nunca vai saber, nunca vai saber.... Feito uma paixão no tempo de escola. Tá combinado na frente dele a gente mal se olha. Ele nunca vai saber, nunca vai saber, nunca vai saber.... Foi no final daquela festa que eu te vi. Sentada no cantinho, sozinha ali,  fiz de tudo pra chamar sua atenção. Ele te deixou sozinha por alguns minutos. Tentei me aproximar meio que de intruso. Típico do cara que por amor, perde a noção. Foi então, que o seu olhar, se cruzou pela primeira vez com o meu. Foi paixao me faltou o ar. E a solução eu acabo de encontrar. Vamos namorar escondido. Pra que tanto tempo perdido. Eu juro que ele nunca vai saber, nunca vai saber, nunca vai saber.... Feito uma paixão no tempo de escola. Tá combinado na frente dele a gente mal se olha. Ele nunca vai saber, nunca vai saber, nunca vai saber... (2x). Uooo uoo uo...  "
494,Eva,Umberto Tozzi, Prima o poi di follia scoppiera' mezza umanita'. Su di noi stormi di nucleari avvoltoi. Ma l'amore e' un dio. E saremo io e te l'arca di noe'. Questo amore crea e alla fine. Di questa odissea. Saro' adamo e tu sarai. Una piccola eva eva. Il nostro amore e' l'ultima astronave eva. Staremo stretti ma ci salvera'. Come un uovo di eternita'. Che si torna ad aprire eva. Abbracciami di mare dolce piovra eva. E ci respireremo finche' vuoi con. Le ali di arcangeloa. Nello spazio di un attimo. Al di la' degli oceani. Anfibi come nuovi. Marinai su new york. Su beirut teschi di mammouth. Su maree di bambini ridotti a bambu'. La mia vita e' un flash. Per chi liscia I bottoni antiatomici. Ma l'amore crea. E alla fine di questa odissea. Saro' adamo e tu sarai. Una piccola eva eva. Il nostro amore e' l'ultima astronave eva. Staremo stretti ma ci salvera'. Come un uovo di eternita'. Che si torna ad aprire eva. Abbracciami di mare dolce piovra eva. E ci respireremo finche' vuoi con. Le ali di arcangelo. Nello spazio di un attimo. Al di la' degli oceani. Anfibi come nuovi adamo ed eva eva. Il nostro amore e' l'ultima astronave eva. Staremo stretti ma ci salvera'. Come un uovo di eternita'. Oh mia piccola eva eva. Abbracciami di mare dolce piovra eva. Staremo stretti ma ci salvera'. Come un uovo di eternita'. Oh mia piccola eva eva. Abbracciami di mare dolce piovra eva. Staremo stretti ma ci salvera'. Come un uovo di eternita'..  
495,Pureza da Paixão,Cheiro De Amor," Meu bem, você chegou. Me tirou da solidão. Acabou minha tristeza numa forte sedução. Se hoje estou feliz, agradeço a você. Esse amor é verdadeiro e me faz sentir prazer. Eu te dou o meu carinho com a pureza da paixão. Te desejo eternamente dentro do meu coração. Nossas vidas se completam como a lua e o sol. Eu adoro amar você, não há nada melhor. Você já sabe que eu sou o seu amor. Vou te abraçar, me aquecer no seu calor.  "
496,Jacaré Poiô,Cacuriá de Dona Teté, Eu sou eu sou eu sou. Eu sou jacaré poiô. Eu sou eu sou eu sou. Eu sou jacaré poiô. Sacode o rabo jacaré. Sacode o rabo jacaré. Eu sou jacaré poiô.  
497,Vaza Canhão,Trio da Huanna," E eu conheci uma menina na Internet. Ela me disse que é um verdadeiro avião. Eu marquei um encontro com ela na avenida sete. E quando eu vi a menina pirei o cabeção. Ela tem cara de jaca. Nariz de chulapa. Estria nas pernas. Bunda de peteca. Perna de alicate. Cabelo de asolã. Ela é caolha. Tem unha encravada. Boca de disdentada. Barriga dobrada. Tirando a camisa o peito batia no chão. Ela é corcunda,. Desengonçada. Cintura de ovo. Com a cara manchada. E quando ela fala o bafo é de leão. Tem um caroço nas costa. Com a voz grossa. A cara torta. Minha resposta na hora. Foi cantar esse refrão. E o refrão é assim. Vaza canhão . Vaza canhão . Vaza canhão . Vaza canhão. E ela tinha um testão. Tinha um zoião. Não era mulher. Era uma assombração. E ela tinha uma papada. Parecia um urubu. Tinha uma impigem na cara. E cocava uu..uhhhh. . Vaza canhão . Vaza canhão . Vaza canhão . Vaza canhão.  "
498,Oi,Banda 007," Entre ser a sua amiga e não ser nada. Prefiro ser nada. Onde é que eu vou guardar esse amor que tenho aqui. Me fala. Como é que eu vou pegar na sua mão. E não poder te levar pra casa. Ficar tão perto assim da sua boca. E não poder beijálo. E se um dia você me chamar. Pra conversar debaixo de uma árvore. E me contar que se apaixonou por alguém. É esse dia aí, é justamente esse dia. Que eu não quero que aconteça. Então só amizade, me esqueça. E quando você me disser oi. Eu vou responder só oi. Com o meu peito gritando Te amo. Toda vez que você me disser oi. Eu vou responder só oi. Com o meu peito gritando Te amo, te amo, te amooo.  "
499,Hoje É Dia de Ivete! (Samba-Enredo Grande Rio 2017),Ivete Sangalo," E lá vou eu, pé na estrada. E lá vou eu, meu amor. Olhos de fogo da serpente encantada. Iluminavam meu destino a Salvador. A Grande Rio vem dar um banho de axé. Salve Toda essa gente de fé. O tambor da invocada promete. Levanta a poeira, Ivete. A Grande Rio vem dar um banho de axé. Salve Toda essa gente de fé. O tambor da invocada promete. Levanta a poeira, Ivete. (Brilha minha estrela). Brilha minha estrela. Alumia o meu caminhar. Menina baiana do Juazeiro. Saudade mandou um cheiro. Velho Chico, histórias fez lembrar. Nossa Senhora sempre a me guiar. Sol inclemente. Terra seca, era o sertão. Adolescente, abraço o violão. Forroziei, pulei fogueira, viva São João. Minha família, doce inspiração. E lá vou eu, pé na estrada. E lá vou eu, meu amor. Olhos de fogo da serpente encantada. Iluminavam meu destino a Salvador. E lá vou eu, pé na estrada. E lá vou eu, meu amor. Olhos de fogo da serpente encantada. Iluminavam meu destino a Salvador. Cantei a noite buscando o que eu queria. Alegria Alegria. Guitarra, frevo, tambores que têm magia. Ê Bahia Ê Bahia. Com a Eva encantei toda cidade. No trio arrastei as multidões. Canto a minha verdade, africanidade. Mistura de emoções. Meu timbau virou sucesso internacional. Nos palcos do mundo, o estrelato, a consagração. Comunidade, povo do gueto, eu sou. Caxias me abraçou. A Grande Rio vem dar um banho de axé. Salve Toda essa gente de fé. O tambor da invocada promete. Levanta a poeira, Ivete.  "
500,Se Me Chamar Eu Vou,Chiclete Com Banana," Se quer me levar amor. Me leve pro horizonte. Do caminho bem distante. Aonde exista só nós dois. Estou feliz. Com o coração palpitando. Você me tem. Sempre em todos os seus planos. Penso contente em você. Quando preciso te ver. Vou à rua fico na lua. À procura do teu sinal. Se me chamar eu vou. Ao som que furta cor. Que furta coração. Que leva emoção, eu vou, eu vou (2x). Se teu beijo cair lá do céu. Que caia por cima de mim. E todo lampejo de mel. Que caia por cima de mim (2x). Amor........ Se me chamar eu vou. Ao som que furta cor. Que furta coração. Que leva emoção, eu vou, eu vou (2x). Estou feliz. Com o coração palpitando. Você me tem. Sempre em todos os seus planos. Penso contente em você. Quando preciso te ver. Vou à rua fico na lua. À procura do teu sinal. Se me chamar eu vou. Ao som que furta cor. Que furta coração. Que leva emoção, eu vou, eu vou (2x). (volta pro começo).  "
501,Extravasa,Babado Novo," Dominou geral. Sacudiu a praça. Venha que o som é massa. Rock de timbau. Groove de cabaça. E a galera embala...(2x). Uh. Tem que ter. Bola na rede. Prá dizer que é gol. Vem dizer. A todo mundo. Que no nosso amor. Tem que ter. Uma balada. Prá gente dançar. Ah Ah. Extravasa. Libera e joga tudo pro ar. Eu quero ser feliz. Antes de mais nada. Extravasa. Libera e joga tudo pro ar. Ar, ar, ar, ar, ar, ar...(2x). Dominou geral. Sacudiu a praça. Venha que o som é massa. Rock de timbau. Groove de cabaça. E a galera embala.... Tem que ter. Bola na rede. Prá dizer que é gol. Vem dizer. A todo mundo. Que no nosso amor. Tem que ter. Uma balada. Prá gente dançar. Ah Ah. Extravasa. Libera e joga tudo pro ar. Eu quero ser feliz. Antes de mais nada. Extravasa. Libera e joga tudo pro ar. Ar, ar, ar, ar, ar, ar...(2x). ""O entusiasmo no movimento. A atividade na balada. Mais veloz que o vento. Cheio dito na idéia. Do meu papo reto. Aumente o som e dance. Quando tiver por perto. Chega de problema. Quero solução. Oh De boca na boca. Escute a voz. Que vem do coração. Radicalizando. Mas com limite. Hoje é dia de extravasar. Meu irmão"". Tem que ter. Bola na rede. Prá dizer que é gol. Vem dizer. A todo mundo. Que no nosso amor. Tem que ter. Uma balada. Prá gente dançar. Ah Não Não Não Não. Extravasa. Libera e joga tudo pro ar. Eu quero ser feliz. Antes de mais nada. Extravasa. Libera e joga tudo pro ar. Ar, ar, ar, ar, ar, ar.... Extravasa. Libera e joga tudo pro ar. Eu quero ser feliz. Ser feliz, ser feliz. Extravasa. Hê Hê. Libera e joga tudo pro ar. Pro ar Pro ar.  "
502,Hino do Recife,Nelson Ferreira," Mauricéia, um clarão de vitória,. A visão de tua alma produz.. Toda vez que do cimo da história, Se desenha. o teu nome de luz. (Coro). Tecida de claridade. Recife sonha ao luar. Lendária e heróica cidade,. Plantada à beiramar. (2x). Mauricéia, um fulgor vive agora,. Que da Pátria foi belo fanal.. Dezessete Que data e que aurora,. Coroando a cidade imortal.. (Coro). Tecida de claridade. Recife sonha ao luar. Lendária e heróica cidade,. Plantada à beiramar. (2x). E depois, com suprema ousadia,. Uma voz se exaltou senhoril,. Vinte e quatro É daqui que irradia, . Nova luz para o céu do Brasil. (Coro). Tecida de claridade. Recife sonha ao luar. Lendária e heróica cidade,. Plantada à beiramar. (2x).  "
503,Não Me Conte Seus Problemas,Ivete Sangalo," Então não me conte seus problemas. Hoje eu quero paz eu quero amor. Então não me conte seus problemas. Nada de tristeza nem de dor. Esse sol tão lindo gostoso de se ver. Essa vida boa correndo pelas mãos. Esse povo todo cantando pra valer. Solte essa cabeça acelere o coração. Hoje eu to querendo falar de coisa boa. Hoje eu to querendo gostar mais de você. Vamo balançando dando risada à toa. Hoje só não dança quem gosta de sofrer. Então não me conte seus problemas. Hoje eu quero paz eu quero amor. Então não me conte seus problemas. Nada de tristeza nem de dor. Veja bem, ta tudo certo. Nós dois na avenida dançando de coração aberto. Veja bem, Deus não perdoa. Vamo jogar essa mão pra cima que a vida é muito boa. Então não me conte seus problemas. Hoje eu quero paz eu quero amor. Então não me conte seus problemas. Nada de tristeza nem de dor. Esse sol tão lindo gostoso de se ver. Essa vida boa correndo pelas mãos. Esse povo todo cantando pra valer. Solte essa cabeça acelere o coração. Hoje eu to querendo falar de coisa boa. Hoje eu to querendo gostar mais de você. Vamo balançando dando risada à toa. Hoje só não dança quem gosta de sofrer. Veja bem, ta tudo certo. Nós dois na avenida dançando de coração aberto. Veja bem, Deus não perdoa. Vamo pensa positivo que essa vida é muito boa. Então não me conte seus problemas. Hoje eu quero paz eu quero amor. Então não me conte seus problemas. Nada de tristeza nem de dor.  "
504,Gente,Jauperi," Eu não gosto de gente que gosta um pouquinho. Eu não gosto de gente fingida. Eu não gosto de gente que não olha no olho. Gente que reclama da vida. Gente que aperta a mão assim sem apertar. Gente que foge e não encara o olhar. Gente que tem medo, gente que enfraquece. Gente que maltrata, gente que aborrece. Gente que não sabe ser gente. Gente, gente, gente. Ô, gente a gente precisa ser gente. Oxente, a gente precisa de gente. Que abrace, que sorria. Dê a mão, dê alegria. Que abrace, que sorria. Dê a mão, dê alegria. E amor todo dia.  "
505,Y No Hago Mas Na',El Gran Combo," Yo me levanto por la mañana. Me doy un baño y me perfumo. Me como un buen desayuno. Y no hago más na', más na'. Después yo leo la prensa. Yo leo hasta las esquelas. O me pongo a ver novelas. Y no hago más na', más na'. A la hora de las doce. Yo me como un buen almuerzo. De arroz con habichuelas. Y carne guisada, y no hago mas na'. Después me voy a la banca. A dormir una siestita. Y a veces duermo dos horas. Y a veces más, y no hago más na'. Y me levanto como a las tres. Y me tomo un buen café. Me fumo un cigarillito con mi guitarra. Y me pongo a cantar. A la la, a la la, a la la lara la lara. Y a la hora de la comida. Me prepara mi mujer. Un bistec con papas fritas. Con ensalada y mil cosas más. Me lo mango y no hago más na'. Luego me voy al balcón. Cual si fuera un gran señor. A mecerme en el sillón. Con mi mujer a platicar. A larara la la. ¡Ay, cuando se me pega el sueño. Enseguidita me voy a acostar. Y duermo hasta por la mañana. Y no hago más na', más na'. (Qué bueno es vivir así, comiendo y sin trabajar). ¡Oigan, yo nunca he doblado el lomo. Y no pierdan su tiempo, no voy a cambiar. ¡qué va. (Qué bueno es vivir asi, comiendo y sin trabajar). Señores, si yo estoy declarado en huelga, ¡sí. ¡Mi mujer que me mantenga ¿oíste. (Qué bueno es vivir así, comiendo y sin trabajar). Qué bueno, qué bueno, qué bueno. Qué bueno es vivir la vida. ¡Comiendo, durmiendo y no haciendo na'. Oiga compay, ¿usted sabe lo que es estar en un sillón mece que te mece. Esperando que lleguen los cupones del seguro social. ¡Así cualquiera. (Qué bueno es vivir así, comiendo y sin trabajar). Recibiendo la pensión por loco. De loco yo no tengo na', ¡listo que soy. (Qué bueno es vivir así, comiendo y sin trabajar). Qué bueno. Traen un plato de mondongo. Arroz, habichuela y carne guisa, para empezar. (Qué bueno es vivir asi, comiendo y sin trabajar). ¿Quién trabajara ¿quién, yo. Buscate a otro, yo ya hice lo que iba a hacer.  "
506,Nossa Paradinha,Harmonia do Samba," Me dá licença que agora eu vou passar (Bis). Não se aborreça se meu cavaco chorar. O meu cavaco ele bota pra quebrar. E me desculpe se eu empurrei alguem (Bis). Não faço nada só gosto do meu neném (Bis). E levo a vida assim sempre nessa harmonia. A intenção é de dar sempre alegria. Vivo num mundo sem eira nem beira. Na quebradeira verdadeira,verdadeira Quebradeira. Quebradeira verdadeira, verdadeira quebradeira. Mas não importa o que dizem não. Pois tudo isso tem explicação. E demorou para bailar, isso porque. Eu sou da bahia, isso porque é. Swingueira do Harmonia, isso porque. Eu não como nada. e topo qualquer parada, isso porque. Eu sou da bahia, isso porque é. Swingueira do Harmonia, isso porque. Ninguem me segura e minha parada é dura. Lá vou eu. Na paradinha dinha dinha dinha dinha dinha. Na paradinha dinha dinha dinha dinha dinha. Swingueira da bahia. Na paradinha dinha dinha dinha dinha. Na paradinha dinha dinha dinha dinha. Na paradinha dinha dinha dinha dinha. Swingueira do harmonia.  "
507,Jura de Amor,Harmonia do Samba," você veio de repente e reacendeu. uma chama que em mim havia se apagado. logo veio a vontade de me oferecer. ei menina, deixa eu ser seu namorado. respondeume com um sorriso dizendo que sim. parece brincadeira,. hoje estou gamado. não se esqueça que me fez uma jura de amor. quando um brigar,. o outro faz as pazes. (refrão). eu tô gostando dela. sem ela não posso ficar. ela é a dona do meu coração. sem ela não posso ficar. hoje faz parte da minha canção. sem ela não posso ficar.  "
508,O Que Tiver de Ser Vai Ser,Pablo Martins," Alucinado e julgado no meio do furacão. Cada cabeça um pensamento além da intenção. De matar ou morrer, os anjos vão sofrer. Mas se tiver que ser, vai ser. Os anjos vão sofrer. Mas se tiver que ser, vai ser. Os anjos vão sofrer. Mas se tiver que ser, vai ser. [Xamã]. Uh Ah Ele mesmo. Flow pra caralho, soul, funk. Anota a placa do tanque. Ele mesmo. Drink, baralho e skunk. Ela quer me ver mesmo. É só papo reto, ela gosta de veneno. Depois quer vir gemendo. Os anjos da boca do rodo tão vendendo. Era 440 e a conta de luz tava 190, tava anoitecendo. Jantamos à luzin' de vela. Queijo, goiabada, romeu, julieta. Xamã, sou o capeta. Somos john lennon, jon jones. Viver no mundo da lua não vai te salvar dos lobisomens. Me dá sua mão, vou te levar daqui. Desse mundinho escroto, pra. Bem longe, bem longe. Sou autoditada, kungfu. Gafanhoto, afrika bambaataa. Agrião, batata, adriana calcanhoto. Todo dia um hit novo. Dj grego é diplomata. Sua pistola veio no kinder ovo. Humildade prevalece. Não encosta tua mão no wentz de novo, hã. Ouviu. É, 44. 1Kilo. Cartel mcs. [Baviera]. Deus, tira de mim esse ódio. Ou perdoe qualquer episódio. Que eu sorri pelo choro de alguém. Se não tem igualdade, quero os meus no pódio. Cansei de lutar por amor. Sou pedaços do que me restou. Faço som, não sou ator. Normal chorar toda vez que sinto dor. E a lágrima lava a alma. Nada como um dia após o outro dia. Até minhas emoções são racionais. Quero paz, não quero guerra. Ou acaba com essa terra. [Sant]. Baviera, calma. [Baviera]. Calma o quê. Se eu perdi tempo demais. [Sant]. Ah, esqueça lá atrás, só o futuro te salva. [Baviera]. Salva do quê Ancorado no cais. [Sant]. É, mas é no cais que conserta seus traumas. [Baviera e (sant)]. Eu vivi tudo. E vi que o mundo é tipo Se mantenha forte. Claro, duro, sei que a morte tá no escuro. Fiz de tudo, burro. Até que vi que no futuro sorte é respirar ar puro. (É, sorte é respirar ar puro). Seja a própria luz no fim do túnel. (Seja a própria luz no fim do túnel). Eu sou a própria luz no fim do túnel. (Sant). [Sant]. Boas pessoas sofrem. As dores dos mundos. Boas pessoas sofrem. Por mais que anjos soprem. Por que os sinos dobram, hein. Boas pessoas cantam. As dores dos mundos nas mais belas flores do campo. Boas pessoas cantam. Boas pessoas amam e vivem pra sempre. Então vamos. Que o que tiver que ser será. Isso é tudo que nós temos. Não, eu não sei como explicar, mulher. Isso é parte do que somos, é. É muito mais do que lemos, é. É muito mais do que lemas. Que elevamos ao máximo. Levamos à próxima, sem se apoiar em seus lemes, é. Lavamos alma em arte. Estamos mais perto do que fomos. Cravamos nomes, flertamos. Flechamos ao norte. Sabemos bem mais do que achamos. Lavamos alma em arte. Estamos mais perto do que fomos. Cravamos nomes, flertamos. Flechamos ao norte. Sabemos bem mais do que achamos. [Pablo Martins]. Alucinado e julgado no meio do furacão. Cada cabeça um pensamento além da intenção. De matar ou morrer. Os anjos vão sofrer. Mas se tiver que ser, vai ser. Os anjos vão sofrer. Mas se tiver que ser, vai ser. Os anjos vão sofrer. Mas se tiver que ser, vai ser. [Nabrisa]. Um anjo me disse que o senhor me admira. Que quanto mais me pisam, mais a minha estrela brilha. E quanto mais eu escrevo, o diabo fica puto. Roubei o inferno dele e transformei em rap sujo. Que vai limpando tudo até que a tua carne cede. Levantate e resplandece. Tua luz já há de vir. Tu me pede, eu te dou. Mas não pede Repete. Que eu não sou de repetir. Eu nem preciso te encostar. Pra poder te agredir. Porque pra mim ferir teu ego. Tu só precisa me ouvir. Eu poderia abrir as pernas. Mas eu preferi te abrir. Abrir a tua mente e fazer tu perceber. Que acabouse o que era doce. Nego só quer te foder. Acabose o que era doce. O que era boldo se fumou. Acabou do coração todas essas juras de amor. Revoltouse contra todas que você não conquistou. Malandro qualificado, especialista no caô. Pra botar a comida no prato, pega plantão de vapor. Calese. Eu mereci esse cálice. Afasta de mim esse traste. Sabe com toda a sinceridade. Por trás dessa maquiagem. Ó, tenha misericórdia de toda essa malandragem. Calese. Eu mereci esse cálice. Afasta de mim esse traste. Sabe com toda a sinceridade. Por trás dessa maquiagem. Ó, tenha misericórdia de toda essa malandragem. Proteja essa geração. [Doisp]. Eu miro na nuvens. Brindo momentos que a terra é um céu. Anjos e demônios se unem (skrr). Se tem gatilho, puxe. Onde os fracos não tem vez. Meu ás é atitude, fodase. Que os falsos me julguem. Que os falsos me julguem. Um gole pro santo (vish). Anjos olham por mim onde ando. Minha reza é sincera, ela é do sul. E o kush, californiano. É o plano do século. Vidas sem regras enquanto. O mundo todo parece tão contramão. Hoje o chão desce. Grana é a febre. Vida breve tipo função. Um milhão de sonhos nas ruas. Demônios querem minha cabeça. Inimigos não me ferem. Minha mente é fera que eu não domo. Guerra sem dono. Derrubando reis do trono. Nós somos a lei do jogo, kamikaze. Memórias e bençãos. Mais um dia de caça. Um comércio arriscado. Quero o máximo ou nada na negociação (skrr). Ei. Brindo momentos que a terra é um céu. Anjos e demônios se unem. Se tem gatilho, puxe. Onde os fracos não tem vez. Meu ás é atitude, fodase. Que os falsos me julguem. Vivo além das nuvens. [Pablo Martins]. Alucinado e julgado no meio do furacão. Cada cabeça um pensamento além da intenção. De matar ou morrer. Os anjos vão sofrer. Mas se tiver que ser, vai ser. Os anjos vão sofrer. Mas se tiver que ser, vai ser. Os anjos vão sofrer. Mas se tiver que ser, vai ser.  "
509,Sandra,Netinho," Maria aparecida porque apareceu na vida. Maria sebastiana porque deus fez tão bonita. Maria de lourdes porque me pediu uma canção prá ela. Carmesita porque ela sussurrou seja bemvindo. (ao meu ouvido). Na primeira noite quando nós chegamos no hospício. E lá, e lais porque quis me ver. E foi lá no hospício. Salete fez chafé que. É um chá de café que eu gosto. E naquela semana tomar chafé foi um vício. Andréia na estréia. No segundo dia meus laços de fita. E cíntia porque embora choque rosa,. É cor bonita. E ana porque parece uma cigana da ilha. Dulcina porque. É santa, é uma santa e me beijou na boca. Azul porque azul é cor e cor é feminina. Eu sou tão inseguro porque o muro é muito alto. E prá dar um salto. Me amarro na torre no alto da montanha. Amarradão na torre dá prá ir pro mundo inteiro. E onde quer que eu vá no mundo eu vejo a minha torre. É só balançar. Que a corda me leva de volta prá ela. Sandra, sandrinha.  "
