,titulo,artista,letras
238,Nova Paradinha,Harmonia do Samba," Eu quero ver. Você me acompanhar. E vai fazer. Tudo que eu mandar, diga ê. Isso por quê. Eu sou da Bahia negão. Isso por quê. Swingueira do harmonia, meu irmão. Isso por quê. Eu não como nada e topo qualquer parada. Agora bote a mão lá frente. E no agachadinho comece a mandar. A paradinha, dinha, dinha, dinha, dinha, dinha. A paradinha, dinha, dinha, dinha, dinha, dinha. A paradinha, dinha, dinha, dinha, dinha, dinha. A paradinha, dinha, dinha, dinha, dinha, dinha. Agora desce (na tremedeira). Agora sobe (faz a quebradeira). Agora desce (na tremedeira). Agora desce (na tremedeira). Agora sobe (faz a quebradeira). Agora desce (na tremedeira). Agora bote a mão lá frente. E no agachadinho comece a mandar. A paradinha, dinha, dinha, dinha, dinha, dinha. A paradinha dinha, dinha, dinha, dinha, dinha. A paradinha, dinha, dinha, dinha, dinha, dinha. A paradinha, dinha, dinha, dinha, dinha, dinha. Me dá licença, mano, porque agora eu vou passar. O balanço é da folia e nele eu vou me acabar. Sente o clima esquentando, hoje o sangue vai ferver. Essa é a minha banda dá pra mim e pra você. Chegue mais, tudo bem, tudo cem, tá maneiro. Deixa de papo furado, fala logo meu parceiro. Eu vou lhe perguntar você responde com alegria. Quem é Harmonia.  "
239,A Gente Leve,Saulo Fernandes," Sabe o que acontece. Quando a gente esquece de pensar. A gente desce do altar. A gente entende, vê o mar. Sabe quando a gente esquece de tentar. A gente sabe se abraçar, se deixar levar. Sabe o que acontece. Quando a gente se despede de julgar. E a gente leve. A gente leve. A gente amar. E a gente leve. A gente leve. A gente amar. Sabe o que acontece quando a gente cresce. A vida é breve, o tempo segue. Sabe o que acontece. Quando a gente pede num sonhar. O universo bebe. A sorte se apercebe. Deixa a gente tentar. E a gente leve. A gente leve. A gente amar. E a gente leve. A gente leve. A gente amar. Sabe o que sucede. Quando a gente cede ao perdoar. A gente aprende que a mágoa. Fere muito mais que machucar. A gente então aquece a alma, incandesce. A gente então esquece de lembrar. Sabe aquela alegria breve. Sempre breve que se quer eternizar. A gente aprende que a gente só percebe. Quando a gente é leve pra deixar chegar. A gente leve. A gente leve. A gente amar. A gente leve. A gente leve. A gente amar. Sabe o que acontece. Quando a gente esquece de sonhar. A cortina desce. A música prescreve. E o silêncio ocupa o seu lugar. A gente leve. A gente leve. A gente amar. A gente leve. A gente leve. A gente amar.  "
240,Mi Corazón Es Tuyo (part. Kaay),Axel, A la vuelta de este corazón. Viajo en un atajo hacia el amor. Sin escalas y directo a ti. El destino propicio el amor. Ame como en otra dimensión. De tu boca loca me volví. Una tormenta provocaste. Dentro de mis ojos. Cuando te vieron frente a mi. Déjame robar tu corazón. Yo te regalo el mío. Préstale tus alas al amor. Para volar conmigo. Dame una mañana. Cada día de la semana. En donde siempre. Despertemos tu y yo. Fuiste abriendo espacios de color. Dibujaste un mundo en mi interior. Diferente a todo lo que vi. Una tormenta provocaste. Dentro de mis ojos. Cuando te vieron frente a mi. Déjame robar tu corazón. Yo te regalo el mío. Préstale tus alas al amor. Para volar conmigo. Llévame en tu vida. Haz espacio en tu sonrisa. Donde siempre existiremos tu y yo. Mi corazón es tuyo. Porque ya somos tu y yo. Y desde ahora es tuyo. Porque ya somos. Déjame robar tu corazón. Yo te regalo el mío. Préstale tus alas al amor. Para volar conmigo. Déjame robar tu corazón. Préstale tus alas al amor. Para volar conmigo. Llévame en tu vida. Haz espacio en tu sonrisa. Donde existiremos solos tu y yo. En donde siempre despertemos tu y yo. Donde solo tu tendrás mi corazón.  
241,Cheguei Pra Te Amar (part. MC Livinho),Ivete Sangalo," Chega de saudade. Quero sentir seu perfume. Tô de malas prontas pra felicidade. Correndo pra te ver. Pra ficar com você. Amor de verdade não acaba, não. Mesmo que a distância às vezes atrapalhe. Quando o dia amanhecer. E o sol vier me aquecer. Meu coração, de barco a vela. Vai navegar no seu mar. No seu colo, o meu destino. Seu olhar, meu paraíso. Seu sorriso me enche de vida. Me faz sonhar, me faz voar. Vou te encontrar, vou te beijar. Cheguei pra te amar. Trouxe estrelas pra plantar. No nosso céu particular. Cheguei pra te amar. Nós dois na constelação. O universo de paixão. Cheguei pra te amar. Pra te amar (cheguei pra te amar). Pra te amar. Cheguei pra te amar. (Livinho, Livinho). Amor de verdade não acaba, não. Mesmo que a distância às vezes atrapalhe. No seu colo, o meu destino. Seu olhar, meu paraíso. Seu sorriso me enche de vida. Vou te beijar. Cheguei pra te amar. Trouxe estrelas pra plantar. No nosso céu particular. Cheguei pra te amar. Nós dois na constelação. O universo de paixão. Cheguei pra te amar. (Cheguei pra te amar). Pra te amar. Me faz voar, me faz cantar. Vou te encontrar, vou te beijar (te amar). Vou te amar (te amar). Vou te amar (te amar). Vou te amar. Cheguei pra te amar.  "
242,Alouette,Chansons Enfantines," Alouette, gentille alouette. Alouette, je te plumerai. Je te plumerai le bec. Et le bec, et le bec. Alouette, alouette, ah ah ah ah. Je te plumerai la tête. Et la tête, et la tête. Et le bec, et le bec. Alouette, alouette, ah ah ah ah. Je te plumerai le cou. Et le cou, et le cou. Et la tête, et la tête. Et le bec, et le bec. Alouette, alouette, ah ah ah ah. Je te plumerai le dos. Et le dos, et le dos. Et le cou, et le cou. Et la tête, et la tête. Et le bec, et le bec. Alouette, alouette, ah ah ah ah. Je te plumerai les fesses. Et les fesses, et les fesses. Et le dos, et le dos. Et le cou, et le cou. Et la tête, et la tête. Et le bec, et le bec. Alouette, alouette, ah ah ah ah.  "
243,Dança Da Manivela,Axé Bahia," Dança Da Manivela. Dança Da Manivela. Dança Da Manivela. Dança Da Manivela. Eu fui perguntar pra ela meu amor. Se a dança da manivela ela tocou. Eu fui perguntar pra ela meu amor. Se a dança da manivela ela tocou. Dizendo que. Aqui tá quente,aqui tá frio. Muito quente, aqui tá frio. Aqui tá quente, aqui tá frio. Muito quente, aqui tá frio. Pega no dedinho dela. Pega no joelho dela. Pega na coxinha dela. Sobe mais um pouquinho. Pega no rostinho dela. Pega no peitinho dela. Pega na cintura dela. Desce mais um pouquinho. Dança Da Manivela. Dança Da Manivela. Eu fui perguntar pra ela meu amor. Se a dança da manivela ela tocou. Eu fui perguntar pra ela meu amor. Se a dança da manivela ela tocou. Dizendo que. Aqui tá quente,aqui tá frio. Muito quente, aqui tá frio. Aqui tá quente, aqui tá frio. Muito quente, aqui tá frio. Pega no dedinho dela. Pega no joelho dela. Pega na coxinha dela. Sobe mais um pouquinho. Pega no rostinho dela. Pega no peitinho dela. Pega na cintura dela. Desce mais um pouquinho. Dança Da Manivela. Dança Da Manivela. Dança Da Manivela. Dança Da Manivela. Dizendo que. Aqui tá quente,aqui tá frio. Muito quente, aqui tá frio. Aqui tá quente, aqui tá frio. Muito quente, aqui tá frio. Pega no dedinho dela. Pega no joelho dela. Pega na coxinha dela. Sobe mais um pouquinho. Pega no rostinho dela. Pega no peitinho dela. Pega na cintura dela. Desce mais um pouquinho. Dança Da Manivela. Dança Da Manivela. Dança Da Manivela. Dança Da Manivela. Dança Da Manivela.  "
244,Noite Sem Lua,Mestre Toni Vargas," Era uma noite sem lua. Era uma noite sem lua. Era uma noite sem lua. Era uma noite sem lua e eu tava sozinho. Fazendo do meu caminhar o meu próprio caminho. Sentindo o aroma das rosas e a dor dos espinhos. De repente apesar do escuro eu pude saber. Que havia alguém me espreitando sem ter nem porquê. Era hora de luta e de morte, é matar ou morrer. A navalha passou me cortando era quase um carinho. O meu sangue misturouse ao pó e as pedras do caminho. Era hora de pedir axé para o meu orixá. E partir para o jogo da morte, é perder ou ganhar. Eu dei o bote certeiro da cobra, alguém me guiou. Meia lua bem dada é a morte. E a luta acabou. Eu segui pela noite sem lua. Histórias na algibeira. Não é fácil acabar com a sorte de um bom capoeira. Se você não acredita me espera num outro caminho. E prepara bem sua navalha. Eu não ando sozinho.  "
245,Flores da Favela,Jauperi," Ela revirou minha cabeça. Deixou tudo fora do lugar. Deu um nó de quase me enlouqueça. Impossível foi me controlar. Iê, iêêêê eu vou dar um beijo nela. Beijo de maluco pra neguinha que é só minha. Uô Ô Ô. Iê, iêêêê eu vou dar um beijo nela. Pra bater no coração. Pra olhar o seu olhar. Pra pegar na sua mão, meu amor. O meu beijo te beijar. Iê, iêêêê eu vou dar um beijo nela. Beijo de maluco pra neguinha que é só minha. Uô Ô Ô. Iê, iêêêê, eu vou enfeitar a noite de amor. Vou derramar o mar, aaaa, no luar. Os vinhos, nos vinhos, nos sabores. Nas cores da janela, flores da favela. Tudo é ela. Iê, iêêêê eu vou dar um beijo nela. Beijo de maluco pra neguinha que é só minha. Uô Ô Ô. Iê, iêêêê, eu vou dar um beijo melado. Do vinho, açúcar. Pra bater no coração. Pra olhar o seu olhar. Pra pegar a sua mão, meu amor. O meu beijo te beijar. Iê, iêêêê eu vou dar um beijo nela. Beijo de maluco pra neguinha que é só minha. Uô Ô Ô. Iê, iêêêê eu vou dar um beijo nela. Uh Uh Uh Uh Uh Uh Uh Uh Uh. Iê, iêêêê, eu vou dar um beijo nela. Beijo de maluco pra neguinha que é só minha. Iê, iêêêê eu vou te beijar.  "
246,Hino de Brasilia,Neusa Pinho França Almeida, Todo o brasil vibrou. E nova luz brilhou. Quando brasília fez maior a sua glória. Com esperança e fé. Era o gigante em pé.. Vendo raiar outra alvorada em sua história. Com brasília no coração. Epopéia surgir do chão. O candango sorri feliz. Símbolo da força de um país. Capital de um brasil audaz. Bom na luta e melhor na paz. Salve o povo que assim te quis. Símbolo da força de um país.  
247,Minha cara Metade,Banda 007," Eu sei que não. Nossa históriaaa, de amor eu sei, éééé... Não acabou . Eu sei foi sem querer . Magoei você. Você chorou fui eu, por não escutar o meu coração. Não pudi imaginar . Que pudesse amar . Alguém tanto assim. Fiquei com medo e fugi. Mas hoje eu sei. Te amo de verdade . Minha cara metade é você . O teu amor ultrapassou limites. Briguei até comigo pra não te perder. Porque eu te amo. Minha alma gêmea é você.  "
248,Preta,Saulo Fernandes," Agora diz que não me quer. Quer liberdade pra fazer o que quiser.. Oxente, quem te deu axé. Cadê a porra do juízo Perguntou José.. Agora diz que não me amou. Que não me sufocou e quer me deixar.. Até pensei em me perder. Mas penso em você e fico a esperar.. Você me disse que não vai Preta. Preta, Preta.. Até que ponto eu sou feliz. Se eu não tenho você até pra conversar. Você machuca coração,. Você me traz desilusão. E ao mesmo tempo paz.. E agora eu choro pra viver. Sem ter o seu amor. Sem ter o seu querer.. E pra cabeça respirar. Eu fico na viagem de você voltar.. Você me disse que não vai Preta. Preta, Preta.. Ôh, Preta. Meu coração esses dias chorou. Com saudade de você.. E você nem ligou. Despreocupou. Ignorou. Nem quis saber.. Tem nada não, sacana.  "
249,Deus é Brasileiro,Terra Samba," Ônibus lotado. Povo apertado. Será que na vida. Tudo é passageiro. Um calor danado. Povo sem dinheiro. Tenho lá minhas dúvidas. Se Deus é brasileiro.... Ô ô ô ô ô ô. Ô ô ô ô ô ô. Deus não pega ônibus. Nem lotação. Mas deve ouvir pedidos. E reclamação. Não tem nem cor nem sexo. Nem estado civil. Coitado se ele for. O gerente do Brasil.... Me disseram que ele está. Em todo lugar. Nas filas, nas calçadas. Nas antenas e no ar. Não vou fazer pedidos. Nem lhe agradecer. Se Deus está na Terra. Ele vai ter que responder.... Ô ô ô ô ô ô. Ô ô ô ô ô ô. Não leve a mal. Tudo bem ô, rapaz. Ei você ai de cima. Entre outras coisas. Que eu quero saber. Por favor me ensina. Como esse povo que sofre. Com fome, que passa mal. Vai batucar na panela vazia. E fazer carnaval.... Oh Oh Oh. Ai, meu Deus. Eu só quero entender...(4x). Deus não pega ônibus. Nem lotação. Mas deve ouvir pedidos. E reclamação. Não tem nem cor nem sexo. Nem estado civil. Coitado se ele for. O gerente do Brasil.... Me disseram que ele está. Em todo lugar. Nas filas, nas calçadas. Nas antenas e no ar. Não vou fazer pedidos. Nem lhe agradecer. Se Deus está na Terra. Ele vai ter que responder.... Ô ô ô ô ô ô. Ô ô ô ô ô ô. Não leve a mal. Tudo bem ô, rapaz. Ei você ai de cima. Entre outras coisas. Que eu quero saber. Por favor me ensina. Como esse povo que sofre. Com fome, que passa mal. Vai batucar na panela vazia. E fazer carnaval.... Ô ô ô ô ô ô. Ai, meu Deus. Eu só quero entender...(8x).  "
250,Rebolation,Parangolé," Alô minha galera, preste atenção. Rebolation é a nova sensação. Menino e menina, não fiquem de fora,. Que vai começar o pancadão.. O suingue é bom. Gostoso de mais.. Mulheres na frente. Os homens atrás.. Mão na cabeça que vai começar. Rebolation é bom Bom. Rebolation é bom Bom Bom (7x). Bota a mão na cabeça que vai começar. O Rebolation, tion. O rebolation.. O rebolation, tion, rebolation. O Rebolation, tion o rebolation.. O rebolation, tion, rebolation. . Rebolation é bom Bom. Rebolation é bom Bom Bom. Rebolation é bom Bom. Se você fizer fica melhor. (2x). Mão na cabeça que vai começar. O Rebolation, tion. O Rebolation.. O Rebolation, tion, Rebolation.. O Rebolation, tion. O Rebolation.. O Rebolation, tion, Rebolation.. Rebolation é bom Bom. Rebolation é bom Bom Bom (4x). Alô minha galera preste atenção. Rebolation é a nova sensação. Menino e menina, não fiquem de fora,. Que vai começar o pancadão.. O suingue é bom gostoso de mais.. Mulheres na frente. Os homens atrás.. Bota a mão na cabeça que vai começar. O Rebolation, tion. O Rebolation.. O Rebolation, tion, Rebolation.. O Rebolation, tion. O Rebolation.. O Rebolation, tion, Rebolation.. Rebolation é bom Bom. Rebolation é bom Bom Bom. Rebolation é bom Bom. Se você fizer fica melhor. (2x). Bota a mão na cabeça que vai começar. O Rebolation, tion. O Rebolation.. O Rebolation, tion, Rebolation.. O Rebolation, tion. O Rebolation.. O Rebolation, tion, Rebolation.. Vai no rebolation, no Rebolation,. No Rebolation, tion, Rebolation.. O Rebolation, tion o rebolation.. O Rebolation, tion, Rebolation.. Rebolation é bom Bom. Rebolation é bom Bom Bom. Rebolation é bom Bom. Rebolation é bom Bom. Rebolation é bom Bom Bom. Rebolation é bom Bom. O Rebolation é bom..  "
251,Depois Que O Ilê Passar,Ilê Aiyê, Quero ver você Ilê Aiyê . Passar por aqui . Não me pegue . Não me toque . Por favor não me provoque . Eu só quero ver o Ilê passar. Rebentou Ilê Aiyê Curuzu . Passo de Angola Ijexá . Vamos pra cama meu bem . Me pegue agora . Me dê um beijo gostoso . Pode até me amassar . Mas me solte quando o Ilê passar.  
252,Circulou,Saulo Fernandes," Circulou,circulou,circulou,circulou. É tão maravilhoso o nosso amor. É tão maravilhoso o nosso amor. A nossa química bateu. O nosso amor apareceu. Se tem alguém que te quer bem. Esse alguém sou eu. Cola meu corpo com o seu. Ser personagem do prazer. Ou simplesmente ser alguém na sua vida.. Vem cá, pode chegar, deixa de besteira. Sou todo seu, todo seu. Vem cá, pode chegar, deixa de besteira. Eu sou todo seu, todo seu.. Circulou,circulou,circulou,circulou. É tão maravilhoso o nosso amor. É tão maravilhoso o nosso amor. A nossa química bateu. O nosso amor apareceu. Se tem alguém que lhe quer bem, esse alguém sou eu. Cola meu corpo com o seu. Ser personagem do prazer. Ou simplesmente ser alguém na sua vida.. Vem cá, pode chegar, deixa de besteira. Sou todo seu, todo seu. Vem cá, pode chegar, deixa de besteira. Eu sou todo seu, todo seu.. Vamos correr com lua. E perceber que ela corre com você. Não custa perceber. Que ela pode nos guiar.. Vem cá, pode chegar, deixa de besteira. Eu sou todo seu, todo seu. Vem cá, pode chegar, deixa de besteira. Eu sou todo seu, todo seu. Circulou,circulou,circulou,circulou. É tão maravilhoso o nosso amor,. É tão maravilhoso o nosso amor. Circulou, circulou.  "
253,Gerere,É o Tchan," Segure a saia, menina. Não deixe a saia levantar. Eu te peço que guarde essa saia. Porque no Domingo vamos passear. Nós vamos lá no Gera Samba. No meio do samba nós vamos sambar. Coloque a mão nas cadeiras. Dê um remelexo que eu vou cantar. Gererê, Gererê, Gererê no Gera Samba. Se você gerou, eu também. vou gerar no Gera Samba. Eu levei uma carreira. e esta foi pequeniniha. Um facão de sete arrobas,. no roçado uma bainha. Uma cesta de ovos, setecentas galinhas. E o trem corre é por cima da linha. Sim, tô melado, tô melado. Tô melado, meu amor, estou melado,. meu amor. Tô melado, meu amor. Descendo a ladeira, me deu uma tonteira. O povo da preguiça diz que. eu tô é de bobeira. Eu vou embora é devagar, devagarinho. Eu vou embora é devagar, devagarinho. Tô saindo fora devagar, devagarinho. Vou jogar bola, devagar, devagarinho. Eu vou ver Aurora, devagar,. devagarinho. Tô saltando fora, devagar, devagarinho. Vem comigo agora, devagar,. devagarinho. Sambar gostosinho, devagar,. devagarinho. Samba bonitinho, devagar, devagarinho. Eu vou me embora, devagar,. devagarinho. Por Nossa Senhora, devagar,. devagarinho. Saia da minha cola, devagar,. devagarinho"".  "
254,Lo Busque,Ana Bárbara," Voy buscando un corazón que en el verano se perdió. Y no hay más indicios que alguien dijo que en otra cama durmió. (¡Ay, va). Sigo el rastro desolado de un amor desesperado. Que no dijo adiós es más dijo vendría con el alba. Y no volvió, desapareció. Ni huella dejo. Y lo busqué. Hasta debajo de la cama. Y encontré. Pedazos de mi alma. Desangrándose no le importó buscar doctor. O alguna curación pa' que no muriera de amor. De pena murió. Y lo busqué. Hasta debajo de la cama. Y encontré. Pedazos de mi alma. Desangrándose no le importó buscar doctor. O alguna curación pa' que no muriera de amor. De pena murió. Sigo el rastro desolado de un amor desesperado. Que no dijo adiós es más dijo vendría con el alba. Y no volvió... Desapareció. Ni huella dejo. Y lo busqué. Hasta debajo de la cama. Y encontré. Pedazos de mi alma. Desangrándose no le importó buscar doctor. O alguna curación pa' que no muriera de amor. De pena murió. Y lo busqué. Hasta debajo de la cama. Y encontré. Pedazos de mi alma. Desangrándose no le importó buscar doctor. O alguna curación pa' que no muriera de amor. De pena murió.  "
255,Doce Obsessão,Cheiro De Amor," Você chegou. Me encontrou tão amarga e vazia. Me entregou seu amor com carinho. Acabou com a minha solidão. O seu amor. É uma luademel, meu amado. Que ilumina meu céu estrelado. Minha doce obsessão. Confesso que eu não estava assim tão preparada. Pra ver todo esse amor me conquistar. Te peço que você não me abandone. Não deixe nossa chama se apagar. Eu quero te beijar. Te abraçar. Preciso desse amor. E quando anoitecer. Confessar. Que eu amo você.  "
256,Toneladas de Desejo,Timbalada," Grite se quiser gritar. Tá melada de dendê. No cachinho dessa timbalada. Puxa que é teu. No passinho dessa timbalada. Minha princesa. Venho aqui para mostrar. Toneladas de desejo. Do xerém dessa timbalada. Nunca se esqueça. Pro caminho dessa timbalada. Puxa Tête. Viver , valer. O som nos levar. De parangolé pra lá. Vem dizer me que amar é. Hum, hum , hum. Vem ver, valer. O som nos levar. De parangolé pra lá. Vem dizer que a amar é. Uôu, uôu. Leva, leva, leva. Leva a levada do timbal, au, au. Fique se quiser ficar. Tô gostando de saber. Que passeio no teu sorriso. Você me vê. Que tolice é o destino. Sem girar bem. Tens os lábios de favo. Por favor, ainda não sei. Cada noite é um vestido. Que o dia tem. Quando o dia tira o vestido. O sono vem. E hoje, hei. Tô feliz é de lhe ver, hei. Com dinheiro ou sem dinheiro, hei. Eu me viro em fevereiro. E hoje hei. Tô feliz é de lhe ver, hei. Com dinheiro ou sem dinheiro, hei. Fevereiro eu sou. Fevereiro eu vou. Leva, leva, leva leva a levada do timbal.  "
257,Old MacDonald Had a Farm,Kinderlieder," # Old MacDonald had a farm, EIEIO.. And on his farm he had a cow, EIEIO.. With a ""moomoo"" here and a ""moomoo"" there.. Here a ""moo"" there a ""moo"". Everywhere a ""moo"". Old MacDonald had a farm, EIEIO.. # Old MacDonald had a farm, EIEIO.. And on his farm he had a pig, EIEIO.. With an ""oink"" here and an ""oink"" there.. Here an ""oink"" there an ""oink"". Everywhere an ""oink"". With a ""moomoo"" here and a ""moomoo"" there.. Here a ""moo"" there a ""moo"". Everywhere a ""moo"". Old MacDonald had a farm, EIEIO.. # The other animals on old MacDonald´s farm are. # a duck (quackquack). # a dog (wouwwouw). # a sheep (bahbah).  "
258,Pensar Em Você,Daniela Mercury, É só pensar em você. Que muda o dia. Minha alegria dá pra ver. Não dá pra esconder. Nem quero pensar se é certo querer. O que vou lhe dizer. Um beijo seu. E eu vou só pensar em você (2x). Se a chuva cai e o sol não sai. Penso em você. Vontade de viver mais. Em paz com o mundo e comigo (2x). Se a chuva cai e o sol não sai. Penso em você. Vontade de viver mais. Em paz com o mundo e consigo (2x).  
259,Nada Contigo,Los Huracanes del Norte, No he venido a pedirte perdon. ni me siento culpable de nada. no he venido a perdir que me quieras. ni me siento perdido a tu amor. Cada ves que me aviento un alcohol. ya lo sabes que pierdo el sentido. vengo a dar sin pensarlo contigo. aunque se que lo nuestro acabo. No hagas caso si me oyes cantar. si una noche te doy serenata. es que le ando cantando a otra ingrata. y borracho no supe ni a cual. Cada ves que me encuentres por ahi. no sera por que yo lo he querido. puedes creer que el encuentro es casual. pero no quiero nada contigo. Yo no soy como aquel que se va. que se va pero luego regresa. bien me puedo morir de tristeza. pero yo nunca vuelvo jamas. Si borracho te vendo a buscar. aunque toque no me abras la puerta. no te importe si me oyes llorar. o amanezco aqui en tu banqueta. Cada ves que me encuentres por hay. no sera por que yo lo he querido. puedes creer que el encuentro es casual. pero no quiero nada contigo..  
260,Minha Paixão,Banda Eva," Chegou e dominou . A minha vida . Me deixou sem rumo, sem direção . Queria saber . O que foi que fez assim . Queria saber . O que foi que deu mim .  . Oh minha paixão . O que foi que fez assim . Pra ganhar meu coração . Eu queria saber . Onde eu olho . Onde eu ando . Eu só vejo você, minha paixão .  . Foi o amor . Que me pegou enfim . Quando o sino tocou . Você veio chegando . Nossa música rolou.  "
261,Aruanda Ê,Abadá Capoeira," Aruanda ê. Aruanda ê, aruanda. Aruanda ê camará. Vem de dentro do peito. Essa chama que acende. Meu corpo inteiro não pode parar. Eu sou mandingueiro de lá da Bahia. Axé capoeira salve Abadá. (Coro). Oxalá que me guie. Por todo caminho. Não deixe na roda a fé me faltar. Sou vento que sopra eu capoeira. A luta de um povo pra se libertar.  "
262,O Psi chegou (Grito de guerra),Psirico, Quero ver minha banda passar. É um desejo de fã. Daqui não arredo o pé. Só saio de manhã. Jogo o cartaz pro ar. Vou aparecer na tv. Sou fã numero um. O mundo inteiro quer ver. To no camarote. Na concentração. Com muita paz e energia. No meio da multidão (Bis). Conto as horas e segundo pra curtir som. Ê ê ê ê ô. OPsi chegou. Ê ê ê ê ô. E o povão cantou. Apareceu o furacão . Vai começar o show.  
263,Dona Isabel,Mestre Toni Vargas," Código Penal da Republica dos Estados Unidos Do Brasil. Decreto numero 847. De 11 de outubro de 1890. Capítulo 13. Dos vadios e capoeiras. Artigo 402. Fazer nas ruas e praças públicas. Exercícios de agilidade e destreza corporal. Conhecido pela denominação ""Capoeiragem"". Andar em correrias com armas e instrumentos. Capazes de produzir lesão corporal. Provocando Tumulto ou desordem. Ameaçando pessoa certa ou incerta. Ou incutindo temor de algum mal. Pena De Prisão celular de 2 à 6 meses. Parágrafo único. É Considerável circunstancia agravante. Pertencer o capoeira a algum bando ou maúrea. Aos chefes ou cabeças. Se em porá pena em dobro. Iêê. Dona Isabel que história é essa. Dona Isabel que história é essa. Oi ai ai. de ter feito abolição. De ser princesa boazinha que libertou a escravidão. To cansado de conversa. to cansado de ilusão. Abolição se fez com sangue. Que inundava este país. Que o negro transformou em luta. Cansado de ser infeliz. Abolição se fez bem antes. E ainda há por se fazer agora. Com a verdade da favela. E não com a mentira da escola. Dona Isabel chegou a hora. De se acabar com essa maldade. De se ensinar aos nossos filhos. O quanto custa a liberdade. Viva Zumbi nosso rei negro. Que fezse herói lá em Palmares. Viva a cultura desse povo. A liberdade verdadeira. Que já corria nos Quilombos. E já jogava capoeira. Iê viva Zumbi. (Iêê Viva Zumbi, Camará). Iê Rei de Palmares. (Iêê Rei de Palmares, Camará). Iê Libertador. (Iêê Libertador, Camará). Iê Viva Meu Mestre. (Iêê Viva Meu Mestre, Camará). Iê quem me ensinou. (Iêê quem me ensinou, camará). Iê A Capoeira. (Iêê a Capoeira, Camará).  "
