,titulo,artista,letras
724,Te Quiero Igual Que Ayer,Monchy y Alexandra," exandra Hoy vuelvo a sentir tus ojos sobre mi pasado,. y es como una nube repentina pero eterna,. eres un infierno donde corre brisa fresca,. y esa tentacion que dice que aun te amo.... Monchy Yo nunca he podido controlar mis sentimientos,. y hoy soy el licor que se escapo de una botella,. disfraze de canto uno mas de mis silencios, . para decirte.... Monchy Que se me ahoga la vida si tu,. tienes otro amor y no vas a volver. Alexandra Aun tengo tu nombre sembrado en mi piel. Monchy Entonces si puedes volver junto a mi.... Alexandra Y yo quisiera abrazarme de ti, . y llegar al cielo con esa pasion. Monchy Yo pense que habias olvidado el ayer,. Alexandra Yo tambien pensaba pero ya me ves.... Coro. Alexandra Te quiero igual o mas que ayer,. Monchy Yo tambien te quiero igual que ayer, . Alexandra Te quiero igual o mas que ayer, . Monchy Yo tambien te quiero mas que ayer.... Alexandra Y yo quisiera abrazarme de ti,. y llegar al cielo con esa pasion. Monchy Yo pense que habias olvidado el ayer. Alexandra Yo tambien pensaba pero ya me ves ya me ves.... Monchy Eres simplemente el lado bello de mi vida, . eres la esperanza que le queda a mi esperanza,. cuanto diera por hacerte mia vida mia,. y que esta tristeza se convierta en alegria.... Alexandra Es tan evidente que te sigo amando tanto,. que me falta poco para entregarme a tus labios,. que tiemblan mis manos cada vez que estas mas cerca,. y que te extrano.... Alexandra Y que me ahoga la vida tambien,. si descubro que amas a otra mujer. Monchy Como crees que voy a besar otra piel. Alexandra Entonces abrazame y ven junto a mi.... Monchy Yo nunca pude olvidarme de ti, . puedes perdonarme si un dia te falte,. Alexandra Estas perdonado por mi corazon,. Monchy Entonces acompaname en mi cancion.... Alexandra Te quiero igual o mas que ayer,. Monchy Yo tambien te quiero igual que ayer,. Alexandra Te quiero igual o mas que ayer,. Monchy Yo tambien te quiero mas que ayer....  "
725,O Doce,Ivete Sangalo," Não se vá. Que a gente é par. Nós somos céu e mar. Não deixe o nosso amor fugir. Vem tomar um guaraná. Bater um papo já. Na rua pra se distrair. Não invente compromisso. Acho bom parar com isso. Tem alguém que te quer (Tem alguém que te quer). Não me responsabilizo. Tudo a ver você comigo. Sem você tudo é pequeno. Tudo fica mais ou menos. Ah, vem cá. Não tira o doce da boca. Da sua criança. Ah, vem cá. Não tira o doce da boca. De quem te ama. Ah, vem cá. Não tira o doce da boca. Da sua criança. Ah, vem cá. Não tira o doce da boca. De quem te ama. Não se vá. Que a gente é par. Nós somos céu e mar. Não deixe o nosso amor fugir. Vem tomar um guaraná. Bater um papo já. Na rua pra se distrair. Não invente compromisso. Acho bom parar com isso. Tem alguém que te quer (Tem alguém que te quer). Não me responsabilizo. Tudo a ver você comigo. Sem você tudo é pequeno. Tudo fica mais ou menos. Ah, vem cá. Não tira o doce da boca. Da sua criança. Ah, vem cá. Não tira o doce da boca. De quem te ama. Ah, vem cá. Não tira o doce da boca. Da sua criança. Ah, vem cá. Não tira o doce da boca. De quem te ama. Não invente compromisso. Acho bom parar com isso. Tem alguém que te quer (Tem alguém que te quer). Não me responsabilizo. Tudo a ver você comigo. Sem você tudo é pequeno. Tudo fica mais ou menos. Ah, vem cá. Não tira o doce da boca. Da sua criança. Ah, vem cá. Não tira o doce da boca. De quem te ama. Ah, vem cá. Não tira o doce da boca. Da sua criança. Ah, vem cá. Não tira o doce da boca. De quem te ama.  "
726,Dois Grudados,Carlinhos Brown," Como eu gostaria que você soubesse. O quanto eu te quero. E o que eu faria para te manter feliz. Te quero outra vez como te quis. Sempre que a lua vai ao céu. Fico sonhando acordado conversando com você. Te imaginando do meu lado. Preciso lhe contar minha paixão. Preciso ocupar seu coração. Preciso lhe contar minha paixão. Preciso ocupar seu coração. Sei que amar faz penar. Tento encontrar um caminho pra te aninhar. Protejo este amor pra ser só teu. Perfeito este amor maior que eu. Protejo este amor pra ser só teu. Perfeito este amor maior que eu. Me desenhei pra você. Te tatuei em mim. Me desenhei pra você. Te tatuei em mim. Me desenhei pra você, te tatuei em mim. Meu amor tem nome e é uma fêmea. Seus faróis enxergam o alto, seus transformadores dons inspiram e festejam o bem. E eu louco e em mim só desejo o bem para permanecer em sua festa. E amála de forma que ela perceba e eu não precise jurar. Esse sentimento me envaidece. Saio por aí e dá vontade de gritar seu nome ao infinito. Mas não conto pra ninguém. Ela pode sentir o meu melhor. E isto basta no meu repertório de felicidades. Como as pérolas radiantes que a envolvem. Quero voltar aos sedosos braços dela. E dizer que te amo, como da primeira vez.. Dois amores, dois grudados. Num abraço entregados. Em carinhos que desejam não ter fim. Me desenhei pra você. Te tatuei em mim. Me desenhei pra você, te tatuei em mim.  "
727,Bambole,É o Tchan," Vem na pegada do bambo. Do bambo, bambo. Do bambo do bambolê. Vem na pegada do bambo. Do bambo, bambo. Do bambo do bambolê...(2x). Você pode sambar. Com um bambolê. É só se ligar. Prá você aprender. É samba no pé. Ai que gostosura. Menina que quebra. É beleza pura. Menina que quebra. É beleza pura.... Roda no dedinho. Bambolê. Vai no pescoçinho. Bambolê. Passa no ombrinho. Bambolê. Cai na cinturinha. Bambolê. Dá uma rodadinha. Uma quebradinha. Mexe a traseirinha. Minha Pithulinha... Roda, roda, roda. Roda, roda e avisa. Quem remexe desliza. No bambolear...(2x). Vem na pegada do bambo. Do bambo, bambo. Do bambo do bambolê. Vem na pegada do bambo. Do bambo, bambo. Do bambo do bambolê...(2x). Você pode sambar. Com um bambolê. É só se ligar. Prá você aprender. É samba no pé. Ai que gostosura. Menina que quebra. É beleza pura. Menina que quebra. É beleza pura.... Roda no dedinho. Bambolê. Vai no pescoçinho. Bambolê. Passa no ombrinho. Bambolê. Cai na cinturinha. Bambolê. Dá uma rodadinha. Uma quebradinha. Mexe a traseirinha. Minha Pithulinha... Roda, roda, roda. Roda, roda e avisa. Quem remexe desliza. No bambolear...(2x). Vem na pegada do bambo. Do bambo, bambo. Do bambo do bambolê. Vem na pegada do bambo. Do bambo, bambo. Do bambo do bambolê...(4x).  "
728,Não Precisa Mudar,Banda Eva," Não precisa mudar. Vou me adaptar ao seu jeito. Seus costumes, seus defeitos. Seu ciúme, suas caras. Pra que mudálas. Não precisa mudar. Vou saber fazer o seu jogo. Deixar tudo do seu gosto. Sem guardar nenhuma mágoa. Sem cobrar nada. Se eu sei que no final fica tudo bem. A gente se ajeita numa cama pequena. Te faço um poema e te cubro de amor. Então você adormece. Meu coração enobrece. E a gente sempre esquece. De tudo o que passou....  "
729,Nicaragua Nicaragüita,Luis Enrique Mejía Godoy," Ay Nicaragua, Nicaraguita,. la flor mas linda de mi querer,. abonada con la bendita,. Nicaraguita, sangre de Diriangén.. Ay Nicaragua sos mas dulcita,. que la mielita de Tamagas,. pero ahora que ya sos libre,. Nicaraguita, yo te quiero mucho mas.. pero ahora que ya sos libre,. Nicaraguita, yo te quiero mucho mas.. Cuando la canción sube un tono, simplemente hay que. subir un tono los acordes. Ay Nicaragua, Nicaraguita,. la flor mas linda de mi querer,. abonada con la bendita,. Nicaraguita, sangre de Diriangén..  "
730,À La Claire Fontaine,Chansons Enfantines," A la claire fontaine,. M'en allant promener. J'ai trouvé l'eau si belle. Que je m'y suis baigné. Il y a longtemps que je t'aime. Jamais je ne t'oublierai. Sous les feuilles d'un chêne,. Je me suis fait sécher. Sur la plus haute branche,. Un rossignol chantait. Chante rossignol, chante,. Toi qui as le cœur gai. Tu as le cœur à rire,. Moi je l'ai à pleurer. J'ai perdu mon amie,. Sans l'avoir mérité. Pour un bouquet de roses,. Que je lui refusais. Je voudrais que la rose,. Fût encore au rosier. Et que ma douce amie. Fût encore à m'aimer.  "
731,Desejo de Amar,Asa de Águia," Na primeira vez que eu te vi. Foi na Ladeira da Barra. Roupa toda molhada. Te sequei com meu olhar de calor. Na segunda vez que eu te vi. Já foi lá no Campo Grande. Mas no mesmo instante. Como mágica desapareceu. E me faltou coragem pra eu ir de encontro a você. Ai que sacanagem, eu preciso te ver. E me faltou coragem pra eu ir de encontro a você. Na próxima vez que eu te ver eu te queixo. Vou matar meu desejo. Na próxima vez que eu te ver eu te beijo. Saciar meu amor. Na próxima vez que eu te ver eu te queixo. Vou matar meu desejo. Desejo de amar ah, ah. Desejo de amar. Na terceira vez que eu te vi. Achei muita coincidência. Te ver com tanta frequência. E nunca consegui te falar. Já na quarta vez que te vi. Achei que era só brincadeira. Corri a cidade inteira. Mas seu nome não sabia chamar.. Refrão.  "
732,Beija-Flor,Carlinhos Brown," Eu fui embora meu amor chorou. Eu fui embora meu amor chorou. Vou voltar á. Eu vou nas asas de um passarinho. Eu vou nos beijos de um beijaflor. No tictac do meu coração renascerá. No tictac do meu coração renascera. Timbalada é semente de um novo dia. Nordeste sofrimento povo lutador. Entre mares e montanhas com você eu vou. Yo quero te namorar, amor. Yo quero te namorar, amor. Teu lábio é tão doce doce feito mel. Todo azul sua beleza feita cor do céu. Quero me aquecer sentir o seu calor. Rolar pra lá na cama te chamar de amor. Fazer mil poesias pra te conquistar. Deixála simplesmente coberta de flor. Quero me aquecer sentir o seu sabor. Amor é só me chamar que eu vou. Amor é só me chamar que eu vou. Estou sentindo a falta de você. Sonhando com seu beijo espero amanhecer. Tu levas as palavras soltas pelo ar. Yo quero te namorar, amor. Yo quero te namorar, amor. Que te bande, que te bande, que te bande que te bande. Que te bande,que te bande. Preta, yo quero te namorar, amor. Yo quero te namorar, amor. No tictac do meu coração renascerá.  "
733,A Gente Se Vê Depois da Chuva,Tomate," Uma mentira e o tempo fechou. Se eu errei, amor, desculpe, por favor. Já tentei de todo jeito. Te tirar dentro do peito. Já não sei viver sem teu perdão. Não paro de pensar. Te vejo em cada olhar. Não sei viver sem esse sentimento. Por você, é você. A gente se vê depois da chuva. A gente se vê depois da chuva. A gente se vê depois que o dia clarear. Pode o tempo passar, pode secar o mar. Não importa o que aconteça, vou te encontrar. Chanana Chananananan. Chanana Chananananan.  "
734,Meia Lua Inteira,Carlinhos Brown," Meia lua inteira supapo, na cara do fraco estrangeiro tocador, cocar de coqueiro baixo quando engano se enganouooo,. São dindondão São Bento grande homen de movimento martelo do tribunaaal.Sumiu na praça a dentro foi pego sem documento num terreno regional..          REFRÃO. Puerararara, Puerarara terça feira capoeirarara, tô no pé de onde onde der rarara. Verdadeiro rarara, derradeiro rarara, não me impede de cantar rarara, tô no pé de onde der rarara..  biba biriba mim que diga taco de arame cabaça barriga..  são dindondão São Bento........  "
735,Evocação Nº 1,Nelson Ferreira," Felinto, pedro salgado, guilherme, fenelon. Cadê teus blocos famosos. Bloco das flores, andaluzas, pirilampos, apôsfum. Dos carnavais saudosos. Na alta madrugada. O coro entoava. Do bloco a marcharegresso. E era o sucesso dos tempos ideais. Do velho raul moraes. Adeus adeus minha gente. Que já cantamos bastante. E recife adormecia. Ficava a sonhar. Ao som da triste melodia.  "
736,A Fila Andou,Chiclete Com Banana," Nananá Nananananá. Nananá Nananananá. Nananá Nananá. Nananananá...(2x). Cansei de esperar. Na janela de casa. Enchi do seu jogo. Agora vou me virar. Não quero mais lágrimas. Na minha vida.... Cansei desse papo. De te amar sozinho. O meu coração. Tá pedindo carinho. Já virei a página. Da nossa relação.... Já deletei você. Da minha vida. Sem nenhum rancor. Na despedida. O que passou, passou. Já se perdeu. Não volta mais.... Tirei o seu perfume. Da memória. Botei ponto final. Na nossa história. Eu já chorei. Eu já sofri. Mas te esqueci. Preciso ser feliz.... A fila andou. Eu te falei. Não deu valor. Como eu te amei. Agora chora. Já me perdeu. Boa sorte. Vá embora. A fila andou. Eu te falei. Não deu valor. Como eu te amei. Agora chora. Você já me perdeu. Tô fora...(2x). (Repetir a Letra).  "
737,Famo$.a. (Billionaire),Claudia Leitte," Eu quero ser muito famosa,. E ter o seu amor. Mas quero sentar no sofá do Jô. Eu quero casar com você e. Estar na TV. Faturar milhões no BBB. [Refrão]. Sempre que eu vou me deitar. Eu vejo o meu nome brilhar. Mas sinto que se estou com você. Eu tenho paz. E o que eu vou fazer. Se eu quero muito mais. [Travis ""Travie"" McCoy]. Yeah I would have a show like Oprah. I would be the host of, everyday Christmas. Give Travie a wish list. I'd probably pull an Angelina and Brad Pitt. And adopt a bunch of babies that ain't never had shit. Give away a few Mercedes like here lady have this. And last but not least grant somebody their last wish. Its been a couple months since I've single so. You can call me Travie Claus minus the Ho Ho. Get it, hehe, I'd probably visit where Katrina hit. And damn sure do a lot more than FEMA did. Yeah can't forget about me stupid. Everywhere I go Imma have my own theme music. [Refrão]. Oh oh, oh oh eu quero muito mais [2x]. [Travis ""Travie"" McCoy]. I'll be playing basketball with the President. Dunking on his delegates. Then I'll compliment him on his political etiquette. Toss a couple milli in the air just for the heck of it. But keep the fives, twentys completely separate. And yeah I'll be in a whole new tax bracket. We in recession but let me take a crack at it. I'll probably take whatevers left and just split it up. So everybody that I love can have a couple bucks. And not a single tummy around me would know what hungry was. Eating good sleeping soundly. I know we all have a similar dream. Go in your pocket pull out your wallet. And put it in the air and sing. Eu quero ser muito famosa. E usar apenas Louboutin. Ter no Twitter um milhão de fãs. Eu quero um carrão blindado. E você do lado. Quero selinho da Hebe Camargo. [Refrão]. Oh oh, oh oh eu quero muito mais [2x]. Eu quero ser muito famosa. E ter o seu amor....  "
738,A Tomada,É o Tchan," Olha a brincadeira da tomada. Chega pra cá, pra brincadeira da tomada. Seus braços vão ficar bem lá no alto. O seu par também coloca as mãos pro alto. Pluga a mão direita. Pluga a mão esquerda. Deixa coladinha e vai, vai, vai, vai. Encaixa (6 vezes). Remexe e agacha.  "
739,Faraó Divindade do Egito,Banda Mel," Deuses. Divindade Infinita Do Universo. Predominante. Esquema Mitológico. A Ênfase Do Espírito Original. Exu. Formará. Do Eden Um ovo Cósmico. A Emersão. Nem Osíris Sabe Como Aconteceu. A Emersão. Nem Osíris Sabe Como Aconteceu. A Ordem Ou Submissão. Do Olho Seu. Transformouse. Na Verdadeira Humanidade. Epopéia. Do Código De Geb. E Nut. Gerou As Estrelas. Osiris. Proclamou Matrimônio Com Isis. E o Mau Set. Irado Assassinou. Impera. Hórus Levando Avante. A Vingança do Pai. Derrotando o Império do Mau Set. Ao Grito Da Vitória. Que Nos Satisfaz. Cadê. Tutancamom. Hei Gizé. Acainaton. Hei Gizé. Tutancamom. Hei Gizé. Akhenaton. Eu Falei Faraó. Êeeee Faraó. Clamo Olodum Pelourinho. Êeeee Faraó. Pirâmide a base do Egito. Êeeee Faraó. Clamo Olodum Pelourinho. Êeeee Faraó. Que Mara, Mara. Maravilha é. Egito,Egito Ê. Que Mara, Mara. Maravilha é. Egito,Egito Ê. Que Mara, Mara. Maravilha é. Egito,Egito Ê. Que Mara, Mara. Maravilha é. Egito,Egito Ê. Faraó ó ó ó Ó. Faraó ó ó ó Ó. Faraó ó ó ó Ó. Faraó ó ó ó Ó. Pelourinho. Uma Pequena Comunidade. Que Porém Olodum Guia. Em Laço De Confraternidade. Despertaivos a. Cultura Egipicia no Brasil. Em Vez De cabelos Trançados. Veremos Turbantes De Tutancamom. E Nas Cabeças. Se Enchem De Liberdade. O Povo Negro Pede Igualdade. E Deixamos De Lado As Separações. Cadê. Tutancamom. Hei Gizé. Akhenaton. Hei Gizé. Tutacamom. Hei Gizé. Akhenaton. Eu Falei Faraó. Êeeee Faraó. Esse é Olodum Arebentando. Êeeee Faraó. Batendo Na Palma Da Mão. Êeeee Faraó. Esse é Olodum Arebentando. Êeeee Faraó. Tutancamom. Hei Gizé. Akhenaton. Hei Gizé. Tutancamom. Hei Gizé. Akhenaton. Eu Falei Faraó. Êeeee Faraó. Clamo Olodum Pelourinho. Êeeee Faraó. Pirâmide a base do Egito. Êeeee Faraó. Clamo Olodum Pelourinho. Êeeee Faraó. Que Mara, Mara. Maravilha é. Egito,Egito Ê. Que Mara, Mara. Maravilha é. Egito,Egito Ê. Que Mara, Mara. Maravilha é. Egito,Egito Ê. Que Mara, Mara. Maravilha é. Egito,Egito Ê. Faraó ó ó ó Ó. Faraó ó ó ó Ó. Faraó ó ó ó Ó. Faraó ó ó ó Ó.  "
740,Então Tá Combinado,Quintal da Cultura, Se agente combina. De Brincar de outra maneira. Troca tudo de lugar. E muda a Brincadeira. Eu agora era você. Você agora vira ele. Ele agora vira ela. Ela agora vira eu. Então ta combinado. Então ta tudo trocado. Então ta tudo mudado. Então ta.... Ta combinado.  
741,La Chona,Los Tucanes de Tijuana," Contare la historia de una famosa persona. Todos la conocen con el apodo de chona. Todos la conocen con el apodo de chona. Su marido dice ya no se que hacer con ella. Diario va los bailes y se compra una botella. Diario va los bailes y se compra una botella. Se arranca la banda con la primera cancion. Y la chona luego luego busca bailador. Y la chona luego luego busca bailador. La gente la mira y le empieza grita. Bravo bravo chona nadie te puede igualar. Y la chona se mueve, y la gente le grita. No hay mejor que la chona, para la quebradita. Y la chona se mueve, al ritmo que le tocen. Ella baila de todo, nunca pierde su trote.  "
742,Somos uno,Axel," Yo soy lo que soy no soy lo que ves. Yo soy mi futuro y soy mi ayer. Y hoy tan sólo soy este amanecer. Y los ojos que te vieron nacer. Soy tan simple que casi ni me ves. Yo soy lo que soy no soy lo que ves. No soy cuna de oro ni simple moisés. Soy el desamparo del corazón. De aquel que pelea y no tiene voz. Soy la mano que te quiere ayudar. No hablo solo de mí cuando digo que soy. Te hablo de ese lugar donde nace el amor que sueñas. Oh oh oh oh oh. Somos tan distintos e iguales. Oh oh oh oh oh. Somos el que siente y el que no está. Oh oh oh oh oh. Somos tan distintos e iguales. Oh oh oh oh oh. Todos somos uno con los demás. La piedra y el río, el cielo, la flor. Todos somos uno con los demás. El lobo, el cordero, y el mismo Dios. Todos somos uno. Yo soy lo que soy no soy lo que ves. Soy mi pasado y soy mi después. Soy libre y dichoso por elección. Soy un loco inquieto pidiendo paz. Soy la mano que te quiere ayudar. No hablo solo de mí cuando digo que soy. Te hablo de ese lugar donde nace el amor que sueñas. Oh oh oh oh oh. Somos tan distintos e iguales. Oh oh oh oh oh. Somos el que siente y el que no está. Oh oh oh oh oh. Somos tan distintos e iguales. Oh oh oh oh oh. Todos somos uno con los demás. La piedra y el río, el cielo, la flor. Todos somos uno con los demás. El lobo, el cordero, y el mismo Dios. Todos somos uno. Oh oh oh oh oh. Somos tan distintos e iguales. Oh oh oh oh oh. Somos el que siente y el que no está. Oh oh oh oh oh. Somos tan distintos e iguales. Oh oh oh oh oh. Todos somos uno con los demás. Todos somos uno con los demás. Todos somos uno con los demás. Todos somos uno con los demás. Todos somos uno con los demás. Somos tan distintos e iguales. Todos somos uno con los demás. Somos tan distintos e iguales. Todos somos uno.  "
743,Sayonara Sayonara,Kyu Sakamoto, Sayounara  Sayounara. Kimi ni agete yookata. Sayounara  Sayounara. Kimi ni agete yookata. Sayounara  Sayounara. Totemo totemo tanoshikata. Sayounara  Sayounara. Totemo totemo  tanoshikata. Sayounara  Sayounara. Motto motto hanashika ata. Sayounara  Sayounara. Motto motto hanashika ata. Sayounara  Sayounara. Itsumademo itsumademo ogenki de. Sayounara  Sayounara. Itsumademo itsumademo ogenki de. Sayounara  Sayounara. Itsumademo itsumademo wasurenai. Sayounara  Sayounara. Itsumademo itsumademo wasurenai.  
744,Emotion In Motion,Ric Ocasek," I would do anything. T'hold on to you. That's just about anything. Until you pull through. I'd hold on to you. Til the stars no longer wink. I'd hold on to you. Til you figure out. Just what to think, 'cause. You're emotion in motion. My magical potion. You're emotion in motion. To me. I would go anywhere. To meet up with you. That's just about anywhere. For one rendezvous. I'd hold on to you. Until the mountains crumble flat. I'd hold on to you. Until you figure out. Just where you're at, 'cause. You're emotion in motion. My magical potion. You're emotion in motion. To me. Yeah. I would do anything. T'hold on to you. That's just about anything. That you want me to. I'd hold on to you. Until you take it all in stride. I'd hold on to you. Til you want to stay here. By my side, 'cause. You're emotion in motion. My magical potion. You're emotion in motion. To me.  "
745,Guantanamera,Compay Segundo, Guantanamera. Guajira Guantanamera. Guantanamera. Guajira Guantanamera. Yo soy un hombre sincero. De donde crece la palma. Yo soy un hombre sincero. De donde crece la palma. Y antes de morir yo quiero. Echar mis versos del alma. Yo soy un hombre sincero. De donde crece la palma. Yo soy un hombre sincero. De donde crece la palma. Y antes de morir yo quiero. Echar mis versos del alma. Guantanamera. Guajira Guantanamera. Guantanamera. Guajira Guantanamera. No me pongan en lo oscuro. A morir como un traidor. No me pongan en lo oscuro. A morir como un traidor. Yo soy bueno y como bueno. Moriré de cara al sol. Guantanamera. Guajira Guantanamera. Guantanamera. Guajira Guantanamera. Con los pobres de la tierra. Quiero yo mi suerte echar. Con los pobres de la tierra. Quiero yo mi suerte echar. El arroyo de la sierra. Me complace más que el mar. Guantanamera. Guajira Guantanamera. Guantanamera. Guajira Guantanamera. Tiene el leopardo un abrigo. En su monte seco y pardo. Tiene el leopardo un abrigo. En su monte seco y pardo. Yo tengo más que el leopardo. porque tengo un buen amigo. Guantanamera. Guajira Guantanamera. Guantanamera. Guajira Guantanamera. Guantanamera. Guajira Guantanamera. Guantanamera. Guajira Guantanamera.  
746,Prima Marilu,Trio da Huana," O nome dela é marieta... pega na buchecha. A prima é marilu... pega no bumbum. Segurança é o foguinho... ele é fortinho. Gosto de cebola... pega na vassoura. Eu me chamo tiririca... bota ela na fita. Bota ela na fita... bota ela na fita. Bota ela na fita... bota ela na fita. Conheci uma garota assanhada. Diz pra mim que é boa na pegada. Tô afim de dar uma arrochada. Dona do pedaço a melhorzinha da parada. Conheci uma garota assanhada. Diz pra mim que é boa na pegada. Tô afim de dar uma arrochada. Dona do pedaço a melhorzinha da parada. Ela me deu um ziguinal. E desapareceu. Eu quero saber onde ela se meteu. Ela me deu um ziguinal. E desapareceu. Eu quero saber onde ela se meteu. E o nome dela é Marieta... pega na buceta. A prima é marilu... pega no seu cu. O segurança é o foguinho... pega no pintinhp. Gosto de cebola... pega na minha rola. E eu me chamo tiririca bota ela na fita. Bota ela na fita, bota ela na fita mãe,. Bota ela na fita, bota ela na fita ê,. Bota ela na fita, bota ela na fita. Conheci uma garota assanhada. Diz pra mim que é boa na pegada. Tô afim de dar uma arrochada. Dona do pedaço a melhorzinha da parada. Ela me deu um ziguinal. E desapareceu. Eu quero saber onde ela se meteu. O nome dela é Marieta pega na buchecha. A prima é Marilu pega no bumbum. O Maickon é o foguinho pega no pelinho. Com gosto de cebola pega na minha rola. O nome dela é Marieta... pega na buchecha. A prima é marilu... pega no bumbum. O segurança é o foguinho... pegaa no pintinho. Gosto de cebola... pega na minha rola. E eu me chamo Roberval... é cara de pau. É cara de pau, é cara de pau. É cara de pau, é cara de pau. É cara de pau, é cara de pau.  "
747,Amar Você Não Dói,Chiclete Com Banana," Sempre me lembro de você.   Com esse jeito tão estranho.   No segredo desse amor.   Seja ele como for.   Amar você... não dói..   O pedaço de você.   Alucina o meu juízo.   Você é meu paraíso.   É só sonhar.... Ô, ô, ô, ô, meu bem, meu bem, me dá,. Ô, ô, ô, ô, meu bem, meu bem, me dá.   A aventura do teu beijo. Ô, ô, ô, ô, meu bem, meu bem, me dá,. Ô, ô, ô, ô, meu bem, meu bem, me dá.   Teu silêncio, teu prazer.    Quero você e o sol. Num grande amor sem fim. Dentro de um céu azul. Ô, timbaiê,. Ô, timbaiê,. Ô, timbaiê,.    Quero você e o sol. Num grande amor sem fim.  "
748,OFERENDAR,Xico Bizerra," Deixa eu me banhar no orvalho fresco desse teu amor. Deixa eu me molhar na cachoeira do teu carinhar. Deixa eu me entranhar pelas veredas do teu coração. Deixa eu desvendar tua paixão, deixa eu me apaixonar. Deixa eu desvendar tua paixão, deixa eu me apaixonar. Deixa eu beber no teu riacho, um tacho de água cristalina. Deixa eu fecundar tua semente, no ventre de uma chuva fina. E a cada manhã o meu amor te oferendar. E a cada manhã o meu amor te oferendar. Minha boca te espiando e nada te dizendo. Meus olhos alumiando, tudo a te falar. E cá dentro do peito um pobre coração batendo. Contendo um balaio cheio de amor pra dar. Vem, me dá um cheiro, que eu te dou o meu. Se avexe, vem ligeiro, chegue cá pra riba deu. Vem, me dá teu cheiro, que eu te dou o meu amor. E a minha vida do jeitim que deus crio.  "
